{
  "schema": "paper_set@1",
  "run_id": "run-20261022-a1",
  "set_id": "candidates-1",
  "kind": "candidates",
  "label": "Candidates after deduplication",
  "made_by": "op-2",
  "created_at": "2026-10-22T10:01:10Z",
  "members": [
    {
      "paper": {
        "key": "openalex:W1485009520",
        "keys": [
          "openalex:W1485009520",
          "doi:10.48550/arxiv.1506.04214",
          "arxiv:1506.04214"
        ],
        "title": "Convolutional LSTM Network: A Machine Learning Approach for Precipitation Nowcasting",
        "year": 2015,
        "authors": [
          "Xingjian Shi",
          "Zhourong Chen",
          "Hao Wang",
          "Dit-Yan Yeung",
          "Wai-kin Wong",
          "Wang-chun Woo"
        ],
        "venue": null,
        "type": "preprint",
        "cited_by_count": 6648,
        "abstract": null,
        "keywords": [
          "precipitation nowcasting",
          "convolutional LSTM"
        ],
        "url": "https://arxiv.org/abs/1506.04214",
        "in_archive": true
      },
      "provenance": [
        {
          "via": "search",
          "query_id": "q1",
          "rank": 1
        },
        {
          "via": "search",
          "query_id": "q2",
          "rank": 4
        }
      ]
    },
    {
      "paper": {
        "key": "openalex:W3202525453",
        "keys": [
          "openalex:W3202525453",
          "doi:10.1038/s41586-021-03854-z"
        ],
        "title": "Skilful precipitation nowcasting using deep generative models of radar",
        "year": 2021,
        "authors": [
          "Suman Ravuri"
        ],
        "venue": "Nature",
        "type": "article",
        "cited_by_count": 916,
        "keywords": [
          "precipitation nowcasting",
          "generative model"
        ],
        "url": "https://doi.org/10.1038/s41586-021-03854-z",
        "in_archive": false
      },
      "provenance": [
        {
          "via": "search",
          "query_id": "q3",
          "rank": 1
        }
      ]
    },
    {
      "paper": {
        "key": "doi:10.1000/example.seasonal",
        "keys": [
          "doi:10.1000/example.seasonal"
        ],
        "title": "Seasonal rainfall outlooks with gradient boosting",
        "year": 2020,
        "authors": [],
        "cited_by_count": 3,
        "keywords": [
          "seasonal forecast"
        ],
        "in_archive": false
      },
      "provenance": [
        {
          "via": "search",
          "query_id": "q1",
          "rank": 37
        }
      ]
    }
  ]
}
